{
  "$schema": "http://json-schema.org/draft-07/schema#",
  "$id": "cycle-dossier",
  "title": "CycleDossier",
  "description": "The aggregated, committed record of one evolve-loop cycle (ADR-0055). Written to knowledge-base/cycles/cycle-N.json by dossier.Write at closeout; validated by evolve dossier verify.",
  "type": "object",
  "required": ["cycle", "goal", "final_verdict", "phases"],
  "additionalProperties": false,
  "properties": {
    "schema_version": {
      "type": "integer",
      "minimum": 2,
      "description": "Forward-only dossier schema discriminator. Absent on legacy records."
    },
    "cycle": {
      "type": "integer",
      "minimum": 1,
      "description": "Cycle number (1-based)."
    },
    "run_id": {
      "type": "string",
      "description": "CA.2 run ULID — unique per run, threads every ledger entry."
    },
    "goal": {
      "type": "string",
      "minLength": 1,
      "description": "The cycle goal text."
    },
    "final_verdict": {
      "type": "string",
      "enum": ["PASS", "WARN", "FAIL"],
      "description": "Aggregated cycle outcome."
    },
    "commit_sha": {
      "type": "string",
      "description": "Git commit SHA shipped this cycle (empty when cycle did not ship)."
    },
    "tree_sha": {
      "type": "string",
      "description": "Git tree SHA of the shipped commit."
    },
    "tasks": {
      "type": "array",
      "items": { "type": "string" },
      "description": "Task ids triage COMMITTED for this cycle (top_n). An empty array is meaningful: the cycle committed to nothing."
    },
    "started_at": {
      "type": "string",
      "description": "RFC3339 timestamp when the cycle started."
    },
    "ended_at": {
      "type": "string",
      "description": "RFC3339 timestamp when the cycle ended."
    },
    "phases": {
      "type": "array",
      "minItems": 1,
      "description": "Ordered phase records (one per executed phase).",
      "items": {
        "$ref": "#/definitions/PhaseRecord"
      }
    },
    "defects": {
      "type": "array",
      "description": "Structured defects (required when final_verdict=FAIL).",
      "items": {
        "$ref": "#/definitions/Defect"
      }
    },
    "failure": {
      "$ref": "#/definitions/FailureRecord"
    },
    "system_failure": {
      "$ref": "#/definitions/SystemFailureSignal"
    },
    "decisions": {
      "type": "array",
      "description": "Key decisions made during this cycle.",
      "items": {"type": "string"}
    },
    "lessons": {
      "type": "array",
      "description": "Narrative learnings from the retrospective.",
      "items": {
        "$ref": "#/definitions/Lesson"
      }
    },
    "carryover": {
      "type": "array",
      "description": "Work items for the next cycle (required when final_verdict=FAIL).",
      "items": {
        "$ref": "#/definitions/Carryover"
      }
    },
    "skipped_phases": {
      "type": "array",
      "description": "Phases that genuinely did NOT run, with the cause (closeout after an abnormal mid-cycle exit). A phase that RAN and returned non-PASS belongs in phases_run_verdict_not_adopted, never here.",
      "items": {
        "$ref": "#/definitions/SkippedPhase"
      }
    },
    "phases_run_verdict_not_adopted": {
      "type": "array",
      "description": "Non-floor phases that RAN and returned non-PASS after the floor verdict was set, so their verdict was declined rather than allowed to overwrite the floor-derived final_verdict (cycle-802).",
      "items": {
        "$ref": "#/definitions/VerdictNotAdopted"
      }
    },
    "spine_fail_opens": {
      "type": "array",
      "description": "Every spine-gate fail-open the cycle took: the phase entered anyway, the first unsatisfied predecessor anchor, and the reason (cycle-1166).",
      "items": {
        "$ref": "#/definitions/SpineFailOpen"
      }
    },
    "timing": {
      "$ref": "#/definitions/TimingSummary"
    },
    "ci_watch": {
      "$ref": "#/definitions/CIWatchRecord"
    },
    "recalled_lessons": {
      "type": "array",
      "items": {"type": "string", "minLength": 1},
      "description": "Ids of the lessons seedTaskRecall injected into this cycle phase prompts, in lookup order, read from recalled-lessons.json. Absent when none were injected."
    },
    "explanation_corrections": {
      "type": "array",
      "items": {"type": "string", "minLength": 1},
      "description": "The review evidence of each document-only correction a passing audit's NEEDS_CORRECTION started (X2), in order. Absent when the cycle ran none."
    }
  },
  "definitions": {
    "PhaseRecord": {
      "type": "object",
      "required": ["name", "verdict"],
      "additionalProperties": false,
      "properties": {
        "name": {"type": "string", "minLength": 1},
        "verdict": {"type": "string", "enum": ["PASS", "WARN", "FAIL"]},
        "key_findings": {"type": "string"},
        "artifact_sha": {"type": "string"},
        "signals": {"type": "object"},
        "duration_ms": {"type": "integer", "description": "Phase wall-clock, ingested from phase-timing.json."},
        "started_at": {"type": "string"},
        "ended_at": {"type": "string"},
        "archetype": {"type": "string"},
        "model_source": {"type": "string", "description": "Model provenance: profile | pin | advisor. Absent on a legacy timing log."},
        "resolved_model": {"type": "string", "description": "The concrete model or tier the phase actually ran on."},
        "tokens": {"$ref": "#/definitions/TokenUsage"}
      }
    },
    "SkippedPhase": {
      "type": "object",
      "required": ["phase", "reason"],
      "additionalProperties": false,
      "properties": {
        "phase": {"type": "string", "minLength": 1},
        "reason": {"type": "string"}
      }
    },
    "VerdictNotAdopted": {
      "type": "object",
      "required": ["phase", "verdict"],
      "additionalProperties": false,
      "description": "One phase that ran to completion whose non-PASS verdict was not adopted as the cycle verdict. verdict is what the phase actually returned (FAIL|WARN|SKIPPED).",
      "properties": {
        "phase": {"type": "string", "minLength": 1},
        "verdict": {"type": "string"}
      }
    },
    "SpineFailOpen": {
      "type": "object",
      "required": ["phase", "missing_artifact"],
      "additionalProperties": false,
      "properties": {
        "phase": {"type": "string", "minLength": 1},
        "missing_artifact": {"type": "string", "description": "The FIRST unsatisfied predecessor anchor — the real cause. Phase alone cannot group fail-opens by cause."},
        "reason": {"type": "string", "description": "The fail-open reason verbatim: \"would-block at enforce\" vs \"digest degraded: …\"."}
      }
    },
    "TimingSummary": {
      "type": "object",
      "additionalProperties": false,
      "description": "Cycle-level latency and token roll-up, ingested from phase-timing.json (phasetiming.Summary). Absent when the cycle wrote no timing log. All token fields are zero on a legacy log written before they existed — never fabricated.",
      "properties": {
        "total_ms": {"type": "integer"},
        "phase_count": {"type": "integer"},
        "retried_count": {"type": "integer", "description": "Dispatches that took more than one attempt."},
        "longest_phase": {"type": "string"},
        "longest_ms": {"type": "integer"},
        "by_archetype_ms": {
          "type": "object",
          "description": "archetype -> summed duration_ms.",
          "additionalProperties": {"type": "integer"}
        },
        "total_tokens": {"$ref": "#/definitions/TokenUsage"},
        "tokens_by_archetype": {
          "type": "object",
          "additionalProperties": {"$ref": "#/definitions/TokenUsage"}
        },
        "wasted_tokens": {"$ref": "#/definitions/TokenUsage", "description": "Usage spent by FAIL-verdict entries — work that did not ship."},
        "cache_hit_ratio": {"type": "number", "description": "cache_read/(input+cache_read) over the whole cycle; 0 when there was no input."},
        "hot_phase_count": {"type": "integer", "description": "Phases whose context_fill_ratio reached contextfill.HotThreshold (0.85, inclusive). Entries with no resolvable tier (ratio absent) are never counted."},
        "hot_phases": {
          "type": "array",
          "description": "Names of the phases counted by hot_phase_count. Omitted when none ran hot.",
          "items": {"type": "string"}
        }
      }
    },
    "TokenUsage": {
      "type": "object",
      "additionalProperties": false,
      "properties": {
        "input": {"type": "integer"},
        "output": {"type": "integer"},
        "cache_read": {"type": "integer"},
        "cache_write": {"type": "integer"}
      }
    },
    "Defect": {
      "type": "object",
      "required": ["id", "summary"],
      "additionalProperties": false,
      "properties": {
        "id": {"type": "string", "minLength": 1},
        "severity": {"type": "string"},
        "summary": {"type": "string", "minLength": 1},
        "fix": {"type": "string"}
      }
    },
    "Lesson": {
      "type": "object",
      "required": ["id", "pattern"],
      "additionalProperties": false,
      "properties": {
        "id": {"type": "string", "minLength": 1},
        "pattern": {"type": "string", "minLength": 1},
        "preventive_action": {"type": "string"}
      }
    },
    "Carryover": {
      "type": "object",
      "required": ["id", "action"],
      "additionalProperties": false,
      "properties": {
        "id": {"type": "string", "minLength": 1},
        "action": {"type": "string", "minLength": 1},
        "priority": {"type": "string"}
      }
    },
    "FailureRecord": {
      "type": "object",
      "additionalProperties": false,
      "description": "The FAIL cycle's failure identity, ingested from the workspace artifacts failure-digest.json (fingerprint + pre_class) and audit-fail-reason.json (reasons, <=5 entries of <=200 chars each). Absent on non-FAIL cycles and when the artifacts yielded no content — best-effort, never fabricated.",
      "properties": {
        "fingerprint": {"type": "string"},
        "pre_class": {"type": "string"},
        "reasons": {
          "type": "array",
          "items": {"type": "string"}
        }
      }
    },
    "SystemFailureSignal": {
      "type": "object",
      "required": ["category", "level", "evidence", "halt"],
      "additionalProperties": false,
      "description": "A deterministic system-level failure attached by the orchestrator and preserved verbatim in the committed dossier.",
      "properties": {
        "category": {"type": "string"},
        "level": {"type": "string"},
        "evidence": {"type": "string"},
        "halt": {"type": "boolean"}
      }
    },
    "CIWatchRecord": {
      "type": "object",
      "required": ["sha", "conclusion"],
      "additionalProperties": false,
      "description": "Remote GitHub CI verdict for the cycle's pushed commit, ingested from ci-watch-verdict.json (cycle-748 push-ci-watch-remote-parity). Absent when no watch verdict was recorded — never fabricated.",
      "properties": {
        "sha": {"type": "string", "minLength": 1},
        "conclusion": {"type": "string", "minLength": 1},
        "run_url": {"type": "string"},
        "failing_test": {"type": "string"},
        "checked_at": {"type": "string"}
      }
    }
  }
}
