{
  "cycle": 1453,
  "run_id": "01KZV6V9Z8ST15H9AJBASQZZAT",
  "goal": "Work through the todo inbox by weight; pipeline-repair items first.",
  "final_verdict": "PASS",
  "phases": [
    {
      "name": "cycle-recorded",
      "verdict": "PASS",
      "key_findings": "cycle completed; ledger walk deferred to future slice",
      "tokens": {
        "input": 0,
        "output": 0,
        "cache_read": 0,
        "cache_write": 0
      }
    }
  ]
}
