{
  "schema_version": 2,
  "cycle": 1675,
  "run_id": "01M2F02CQ044XB7DV2AZBGQ7RM",
  "goal": "Pipeline-health verification batch (2026-09-12, two waves): work the highest-weight queued inbox items end-to-end — claim, tdd, build, audit, ship — with full phase integrity, now that the resume worktree teardown (#571), the shipDirect audit binding (#569), resume-path outcome recording (#568), and profile sandbox.write_subpaths grants (#572) are on main. Every cycle must commit to a claimed inbox item (an empty top_n must not run the spine), bind its audit to the changes tree it ships, record a terminal outcome on every exit, and leave no stale worktree behind. Pipeline-integrity and pipeline-repair items come first; ADR-0099 document deliverables are eligible.",
  "final_verdict": "FAIL",
  "tasks": [
    "verdict-sentinel-as-tool-call"
  ],
  "phases": [
    {
      "name": "scout",
      "verdict": "PASS",
      "duration_ms": 143734,
      "started_at": "2026-09-14T03:41:51Z",
      "ended_at": "2026-09-14T03:44:16Z",
      "archetype": "plan",
      "model_source": "profile",
      "resolved_model": "balanced",
      "tokens": {
        "input": 28,
        "output": 9897,
        "cache_read": 911281,
        "cache_write": 80476
      }
    },
    {
      "name": "triage",
      "verdict": "FAIL",
      "duration_ms": 93897,
      "started_at": "2026-09-14T03:44:42Z",
      "ended_at": "2026-09-14T03:46:16Z",
      "archetype": "plan",
      "model_source": "advisor",
      "resolved_model": "balanced",
      "tokens": {
        "input": 0,
        "output": 0,
        "cache_read": 0,
        "cache_write": 0
      }
    }
  ],
  "defects": [
    {
      "id": "audit-fail",
      "severity": "HIGH",
      "summary": "cycle did not pass audit; see audit-report.md + acs-verdict.json",
      "fix": "address the audit findings recorded for this cycle"
    }
  ],
  "carryover": [
    {
      "id": "address-audit-findings",
      "action": "resolve the audit findings that failed cycle 1675",
      "priority": "high"
    }
  ],
  "timing": {
    "total_ms": 237631,
    "phase_count": 2,
    "retried_count": 0,
    "longest_phase": "scout",
    "longest_ms": 143734,
    "by_archetype_ms": {
      "plan": 237631
    },
    "total_tokens": {
      "input": 28,
      "output": 9897,
      "cache_read": 911281,
      "cache_write": 80476
    },
    "tokens_by_archetype": {
      "plan": {
        "input": 28,
        "output": 9897,
        "cache_read": 911281,
        "cache_write": 80476
      }
    },
    "wasted_tokens": {
      "input": 0,
      "output": 0,
      "cache_read": 0,
      "cache_write": 0
    },
    "cache_hit_ratio": 0.9999692749660104,
    "hot_phase_count": 1,
    "hot_phases": [
      "scout"
    ]
  }
}
