{
  "schema_version": 2,
  "cycle": 1713,
  "run_id": "01M3FP1E98ZPHDQQ6798557E1J",
  "goal": "Pipeline-health verification, wave 15 (2026-09-27, on main abc9ced0, the first wave with ADR-0106 P3, Q1 and Q2 live: every tmux phase pane's resolved-prompt.txt ends with the identity statement (\"## Who you are (stated by the evolve bridge)\") and its pane exports CLAUDE_CODE_ENABLE_PROMPT_SUGGESTION=false before the launch; a quota wall met on a correction re-dispatch, a remediation re-run or a resumed review leaves the cycle DEFERRED (all_families_exhausted in the ledger, no failure digest, no retrospective), never FAIL; a login prompt benches the family with operator_action in cli-health.json and no second dispatch goes into it). Work the highest-weight lane-eligible inbox items end-to-end — claim, tdd, build, audit, ship — with full phase integrity, on the fixed plane. That includes everything waves 3–14 verified, and the fixes on this main:\n- (P3) an agent that inspects its pane finds its own session, its prompt files and the sole-writer fact stated in the prompt it was given; a stdout-completion phase is told the bridge reads its pane;\n- (Q1) a walled correction re-dispatch is the same deferral as a walled first dispatch;\n- (Q2) a credential wall is benched until a probe after the operator's login clears it; the bench lines name the fix;\n- (P4, H1, H2, from wave 14) an exit-85 escalation carries its pattern in cause_code; the host derives triage-decision.json from the report before any judge.\n\nEarlier fixes still in force: a worktree ship binds its own tree (#648); routing never sends a lane work its builder's sandbox forbids; a lane's cycle-state override applies only inside its own evolve dir; a Build may `git rm` its own never-committed explanation draft (#651); the explanation contract can move base without a Build when the host proves the change byte-identical (#649).\n\nEvery cycle must:\n- commit to a claimed inbox item (an empty top_n must not run the spine);\n- bind its audit to the changes tree it ships;\n- disposition the cycle's OWN defect ledger as well as inherited ids;\n- record a terminal outcome on every exit;\n- never modify a protected control-plane file by any tool;\n- leave no stale worktree behind.\n\nPipeline-integrity items and items whose fix surface is protected are console-owned, not lane work. ADR-0099 document deliverables are eligible. The measure of this wave is consecutive shipped cycles: 1706 shipped, then 1707 failed on form and 1708/1709 deferred on capacity, so the streak stands at zero; six in a row is the goal.",
  "final_verdict": "WARN",
  "tasks": [
    "gittest-fixture-centralize"
  ],
  "phases": [
    {
      "name": "scout",
      "verdict": "FAIL",
      "duration_ms": 213668,
      "started_at": "2026-09-26T20:21:30Z",
      "ended_at": "2026-09-26T20:25:05Z",
      "archetype": "plan",
      "model_source": "profile",
      "resolved_model": "balanced",
      "tokens": {
        "input": 20,
        "output": 5534,
        "cache_read": 655940,
        "cache_write": 78724
      }
    },
    {
      "name": "triage",
      "verdict": "PASS",
      "duration_ms": 338192,
      "started_at": "2026-09-26T20:25:34Z",
      "ended_at": "2026-09-26T20:37:21Z",
      "archetype": "plan",
      "model_source": "profile",
      "resolved_model": "balanced",
      "tokens": {
        "input": 18,
        "output": 2072,
        "cache_read": 668164,
        "cache_write": 32911
      }
    }
  ],
  "timing": {
    "total_ms": 551860,
    "phase_count": 2,
    "retried_count": 0,
    "longest_phase": "triage",
    "longest_ms": 338192,
    "by_archetype_ms": {
      "plan": 551860
    },
    "total_tokens": {
      "input": 38,
      "output": 7606,
      "cache_read": 1324104,
      "cache_write": 111635
    },
    "tokens_by_archetype": {
      "plan": {
        "input": 38,
        "output": 7606,
        "cache_read": 1324104,
        "cache_write": 111635
      }
    },
    "wasted_tokens": {
      "input": 20,
      "output": 5534,
      "cache_read": 655940,
      "cache_write": 78724
    },
    "cache_hit_ratio": 0.9999713021715194,
    "hot_phase_count": 2,
    "hot_phases": [
      "scout",
      "triage"
    ]
  }
}
