{
  "cycle": 1094,
  "run_id": "01KY71C5FR2RB33M0ZSH16E85H",
  "goal": "9d22f7f9398fa4e2fc8c2a77c8315a906816e20057ec26c8f437295cf59ca517",
  "final_verdict": "FAIL",
  "phases": [
    {
      "name": "scout",
      "verdict": "FAIL",
      "duration_ms": 646987,
      "started_at": "2026-07-23T08:28:30Z",
      "ended_at": "2026-07-23T08:50:15Z",
      "archetype": "plan",
      "tokens": {
        "input": 0,
        "output": 0,
        "cache_read": 0,
        "cache_write": 0
      }
    },
    {
      "name": "retro",
      "verdict": "FAIL",
      "duration_ms": 1852254,
      "started_at": "2026-07-23T08:50:15Z",
      "ended_at": "2026-07-23T09:21:08Z",
      "archetype": "control",
      "tokens": {
        "input": 0,
        "output": 0,
        "cache_read": 0,
        "cache_write": 0
      }
    }
  ],
  "defects": [
    {
      "id": "audit-fail",
      "severity": "HIGH",
      "summary": "cycle did not pass audit; see audit-report.md + acs-verdict.json",
      "fix": "address the audit findings recorded for this cycle"
    }
  ],
  "carryover": [
    {
      "id": "address-audit-findings",
      "action": "resolve the audit findings that failed cycle 1094",
      "priority": "high"
    }
  ],
  "skipped_phases": [
    {
      "phase": "closeout",
      "reason": "abnormal exit in phase retro"
    }
  ],
  "timing": {
    "total_ms": 2499241,
    "phase_count": 2,
    "retried_count": 1,
    "longest_phase": "retro",
    "longest_ms": 1852254,
    "by_archetype_ms": {
      "control": 1852254,
      "plan": 646987
    },
    "total_tokens": {
      "input": 0,
      "output": 0,
      "cache_read": 0,
      "cache_write": 0
    },
    "tokens_by_archetype": {
      "control": {
        "input": 0,
        "output": 0,
        "cache_read": 0,
        "cache_write": 0
      },
      "plan": {
        "input": 0,
        "output": 0,
        "cache_read": 0,
        "cache_write": 0
      }
    },
    "wasted_tokens": {
      "input": 0,
      "output": 0,
      "cache_read": 0,
      "cache_write": 0
    },
    "cache_hit_ratio": 0
  }
}
