{
  "cycle": 480,
  "run_id": "01KWK6DVXEV5PWZJHYJFGEED1K",
  "goal": "GOAL: DRAIN — advance the highest-weight inbox items via a 2-WIDE fleet wave (fleet{count:2}). This is ALSO the integration proof for the fleet cycle-state isolation fix (#302): BOTH concurrent lanes must reach audit+ship without the pre-fix stall. Triage partitions the backlog into 2 disjoint-scoped lanes. Prefer disjoint packages to avoid main-merge conflicts (ship.lock serializes). Strict TDD, every exported symbol named in a same-package _test.go (apicover -enforce), regression test for any bugfix. Low models (haiku) only for the simplest mechanical tasks; advisor decides tiers (opus for audit/adversarial + hard, Sonnet 5 for light/middle).",
  "final_verdict": "PASS",
  "phases": [
    {
      "name": "cycle-recorded",
      "verdict": "PASS",
      "key_findings": "cycle completed; ledger walk deferred to future slice"
    }
  ]
}
