{
  "cycle": 1019,
  "run_id": "01KY285KJQ5MGKBGPDF51V3VM3",
  "goal": "Drain the inbox strictly by weight on the repaired state layer. Structural floors first: acs-verdict-always-written-with-reason (verdict diagnosability), ship-landed-verification-floor, loop-must-base-lanes-on-origin-main, build-selfcheck-hard-gate-at-deliverable-contract (a red selfcheck REFUSES the build deliverable via the E2 correction ladder), percycle-audit-apicover-newexport-parity (redesign the reproduction against a TEMP module copy, flip its skip back to a hard pin, make the composed gate enforcing). Then the operator-directed solutions: codegraph blast-radius per docs/architecture/code-graph-blast-radius.md, triage-unified-solution-synthesis, graduated-remediation-fix-forward, telemetry collectors (run go test ./cmd/evolve/ before handoff — known blocker note in the item). Every fix: TDD red-first, regression test, adversarial audit, wiring proof in the composed production path. No inert API. Tests must NEVER mutate the live repo tree — use temp module copies.",
  "final_verdict": "FAIL",
  "phases": [
    {
      "name": "cycle-recorded",
      "verdict": "FAIL",
      "key_findings": "cycle completed; ledger walk deferred to future slice",
      "tokens": {
        "input": 0,
        "output": 0,
        "cache_read": 0,
        "cache_write": 0
      }
    }
  ],
  "defects": [
    {
      "id": "audit-fail",
      "severity": "HIGH",
      "summary": "cycle did not pass audit; see audit-report.md + acs-verdict.json",
      "fix": "address the audit findings recorded for this cycle"
    }
  ],
  "carryover": [
    {
      "id": "address-audit-findings",
      "action": "resolve the audit findings that failed cycle 1019",
      "priority": "high"
    }
  ],
  "skipped_phases": [
    {
      "phase": "retro",
      "reason": "FAIL"
    }
  ]
}
