{
  "cycle": 1246,
  "run_id": "01KZ39WJFY9DQ3VN3R28J6J9Y8",
  "goal": "9d22f7f9398fa4e2fc8c2a77c8315a906816e20057ec26c8f437295cf59ca517",
  "final_verdict": "FAIL",
  "phases": [
    {
      "name": "cycle-recorded",
      "verdict": "FAIL",
      "key_findings": "cycle completed; ledger walk deferred to future slice",
      "tokens": {
        "input": 0,
        "output": 0,
        "cache_read": 0,
        "cache_write": 0
      }
    }
  ],
  "defects": [
    {
      "id": "audit-fail",
      "severity": "HIGH",
      "summary": "cycle did not pass audit; see audit-report.md + acs-verdict.json",
      "fix": "address the audit findings recorded for this cycle"
    }
  ],
  "failure": {
    "fingerprint": "audit|verdict-fail|7929bd301329",
    "pre_class": "verdict-fail",
    "reasons": [
      "phase audit verdict FAIL routed to retro (agent-graded; see the audit report artifact) defect=frozenpins.go:302-308 resolvePackage consults the frozen test file's alias map first and unconditionally, "
    ]
  },
  "carryover": [
    {
      "id": "address-audit-findings",
      "action": "resolve the audit findings that failed cycle 1246",
      "priority": "high"
    }
  ],
  "phases_run_verdict_not_adopted": [
    {
      "phase": "retro",
      "verdict": "FAIL"
    }
  ]
}
