{
  "cycle": 1122,
  "run_id": "01KYHQX0APN7GY9VTKRN3XZTJY",
  "goal": "9d22f7f9398fa4e2fc8c2a77c8315a906816e20057ec26c8f437295cf59ca517",
  "final_verdict": "FAIL",
  "phases": [
    {
      "name": "scout",
      "verdict": "PASS",
      "duration_ms": 124031,
      "started_at": "2026-07-27T12:14:49Z",
      "ended_at": "2026-07-27T12:16:54Z",
      "archetype": "plan",
      "model_source": "advisor",
      "resolved_model": "balanced",
      "tokens": {
        "input": 16,
        "output": 7069,
        "cache_read": 434359,
        "cache_write": 70795
      }
    },
    {
      "name": "triage",
      "verdict": "PASS",
      "duration_ms": 70666,
      "started_at": "2026-07-27T12:18:19Z",
      "ended_at": "2026-07-27T12:19:30Z",
      "archetype": "plan",
      "model_source": "advisor",
      "resolved_model": "balanced",
      "tokens": {
        "input": 4,
        "output": 1246,
        "cache_read": 85401,
        "cache_write": 34334
      }
    },
    {
      "name": "fault-localization",
      "verdict": "PASS",
      "duration_ms": 73307,
      "started_at": "2026-07-27T12:19:30Z",
      "ended_at": "2026-07-27T12:20:43Z",
      "archetype": "plan",
      "model_source": "advisor",
      "resolved_model": "balanced",
      "tokens": {
        "input": 12,
        "output": 3374,
        "cache_read": 195831,
        "cache_write": 47349
      }
    },
    {
      "name": "tdd",
      "verdict": "PASS",
      "duration_ms": 360463,
      "started_at": "2026-07-27T12:20:43Z",
      "ended_at": "2026-07-27T12:26:44Z",
      "archetype": "plan",
      "model_source": "advisor",
      "resolved_model": "deep",
      "tokens": {
        "input": 30,
        "output": 17989,
        "cache_read": 1105856,
        "cache_write": 94730
      }
    },
    {
      "name": "build",
      "verdict": "PASS",
      "duration_ms": 248453,
      "started_at": "2026-07-27T12:26:44Z",
      "ended_at": "2026-07-27T12:31:07Z",
      "archetype": "build",
      "model_source": "advisor",
      "resolved_model": "deep",
      "tokens": {
        "input": 33,
        "output": 10521,
        "cache_read": 1140501,
        "cache_write": 54190
      }
    },
    {
      "name": "adversarial-review",
      "verdict": "PASS",
      "duration_ms": 291324,
      "started_at": "2026-07-27T12:31:08Z",
      "ended_at": "2026-07-27T12:35:59Z",
      "archetype": "evaluate",
      "model_source": "advisor",
      "resolved_model": "deep",
      "tokens": {
        "input": 26,
        "output": 15436,
        "cache_read": 811696,
        "cache_write": 62121
      }
    },
    {
      "name": "bug-reproduction",
      "verdict": "PASS",
      "duration_ms": 151646,
      "started_at": "2026-07-27T12:35:59Z",
      "ended_at": "2026-07-27T12:38:31Z",
      "archetype": "evaluate",
      "model_source": "advisor",
      "resolved_model": "balanced",
      "tokens": {
        "input": 24,
        "output": 9852,
        "cache_read": 792583,
        "cache_write": 57487
      }
    },
    {
      "name": "audit",
      "verdict": "FAIL",
      "duration_ms": 186016,
      "started_at": "2026-07-27T12:38:31Z",
      "ended_at": "2026-07-27T12:42:58Z",
      "archetype": "evaluate",
      "model_source": "advisor",
      "resolved_model": "deep",
      "tokens": {
        "input": 14,
        "output": 10890,
        "cache_read": 475887,
        "cache_write": 67561
      }
    },
    {
      "name": "retro",
      "verdict": "FAIL",
      "duration_ms": 516174,
      "started_at": "2026-07-27T12:42:58Z",
      "ended_at": "2026-07-27T12:51:34Z",
      "archetype": "control",
      "tokens": {
        "input": 41,
        "output": 34802,
        "cache_read": 1712704,
        "cache_write": 114197
      }
    }
  ],
  "defects": [
    {
      "id": "audit-fail",
      "severity": "HIGH",
      "summary": "cycle did not pass audit; see audit-report.md + acs-verdict.json",
      "fix": "address the audit findings recorded for this cycle"
    }
  ],
  "carryover": [
    {
      "id": "address-audit-findings",
      "action": "resolve the audit findings that failed cycle 1122",
      "priority": "high"
    }
  ],
  "skipped_phases": [
    {
      "phase": "closeout",
      "reason": "abnormal exit in phase retro"
    }
  ],
  "timing": {
    "total_ms": 2022080,
    "phase_count": 9,
    "retried_count": 0,
    "longest_phase": "retro",
    "longest_ms": 516174,
    "by_archetype_ms": {
      "build": 248453,
      "control": 516174,
      "evaluate": 628986,
      "plan": 628467
    },
    "total_tokens": {
      "input": 200,
      "output": 111179,
      "cache_read": 6754818,
      "cache_write": 602764
    },
    "tokens_by_archetype": {
      "build": {
        "input": 33,
        "output": 10521,
        "cache_read": 1140501,
        "cache_write": 54190
      },
      "control": {
        "input": 41,
        "output": 34802,
        "cache_read": 1712704,
        "cache_write": 114197
      },
      "evaluate": {
        "input": 64,
        "output": 36178,
        "cache_read": 2080166,
        "cache_write": 187169
      },
      "plan": {
        "input": 62,
        "output": 29678,
        "cache_read": 1821447,
        "cache_write": 247208
      }
    },
    "wasted_tokens": {
      "input": 55,
      "output": 45692,
      "cache_read": 2188591,
      "cache_write": 181758
    },
    "cache_hit_ratio": 0.9999703923808937
  }
}
