{
  "cycle": 1267,
  "run_id": "01KZ4ZH3BXXQ0NR0526H06M2TJ",
  "goal": "9d22f7f9398fa4e2fc8c2a77c8315a906816e20057ec26c8f437295cf59ca517",
  "final_verdict": "FAIL",
  "phases": [
    {
      "name": "cycle-recorded",
      "verdict": "FAIL",
      "key_findings": "cycle completed; ledger walk deferred to future slice",
      "tokens": {
        "input": 0,
        "output": 0,
        "cache_read": 0,
        "cache_write": 0
      }
    }
  ],
  "defects": [
    {
      "id": "audit-fail",
      "severity": "HIGH",
      "summary": "cycle did not pass audit; see audit-report.md + acs-verdict.json",
      "fix": "address the audit findings recorded for this cycle"
    }
  ],
  "failure": {
    "fingerprint": "audit|infra-error|b7f1e64393b3",
    "pre_class": "infra-error",
    "reasons": [
      "the integration tier (`go test -tags integration`) reported 13 offender(s) — CI's integration-tier test step would FAIL (e.g. TestFleetSoak). Offenders: tmux_repl_interactive_test.go:181: exit = 80,",
      "verdict-conflict: auditor narrative=WARN but 1 deterministic gate(s) forced FAIL [integration-tier gate] — the gate outranks the narrative (ship policy unchanged); both readings are recorded so the "
    ]
  },
  "carryover": [
    {
      "id": "address-audit-findings",
      "action": "resolve the audit findings that failed cycle 1267",
      "priority": "high"
    }
  ],
  "phases_run_verdict_not_adopted": [
    {
      "phase": "retro",
      "verdict": "FAIL"
    }
  ]
}
