{
  "cycle": 1343,
  "run_id": "01KZ97BGVW9RN6WNBEPQHGBBVQ",
  "goal": "9d22f7f9398fa4e2fc8c2a77c8315a906816e20057ec26c8f437295cf59ca517",
  "final_verdict": "FAIL",
  "phases": [
    {
      "name": "cycle-recorded",
      "verdict": "FAIL",
      "key_findings": "cycle completed; ledger walk deferred to future slice",
      "tokens": {
        "input": 0,
        "output": 0,
        "cache_read": 0,
        "cache_write": 0
      }
    }
  ],
  "defects": [
    {
      "id": "audit-fail",
      "severity": "HIGH",
      "summary": "cycle did not pass audit; see audit-report.md + acs-verdict.json",
      "fix": "address the audit findings recorded for this cycle"
    }
  ],
  "failure": {
    "fingerprint": "audit|unknown|cd004b909d40",
    "pre_class": "unknown",
    "reasons": [
      "defect ledger: 1 defect(s) inherited from cycle-1340 are unaccounted for [d095ee8658d7cf8991ba96d74da4efd54 (FIXED but evidence \"go/cmd/evolve/cmd_loop_chain_boundaryrefresh_shortsha_test.go\" resolves"
    ]
  },
  "carryover": [
    {
      "id": "address-audit-findings",
      "action": "resolve the audit findings that failed cycle 1343",
      "priority": "high"
    }
  ],
  "phases_run_verdict_not_adopted": [
    {
      "phase": "retro",
      "verdict": "FAIL"
    }
  ]
}
