{
  "cycle": 1427,
  "run_id": "01KZNKYNYRM3VYKRVDYPPDRN5Y",
  "goal": "work through the queued todo inbox tasks (.evolve/inbox) and carryover todos by priority",
  "final_verdict": "FAIL",
  "phases": [
    {
      "name": "cycle-recorded",
      "verdict": "FAIL",
      "key_findings": "cycle completed; ledger walk deferred to future slice",
      "tokens": {
        "input": 0,
        "output": 0,
        "cache_read": 0,
        "cache_write": 0
      }
    }
  ],
  "defects": [
    {
      "id": "audit-fail",
      "severity": "HIGH",
      "summary": "cycle did not pass audit; see audit-report.md + acs-verdict.json",
      "fix": "address the audit findings recorded for this cycle"
    }
  ],
  "failure": {
    "fingerprint": "audit|verdict-fail|4b04ab0018c9",
    "pre_class": "verdict-fail",
    "reasons": [
      "phase audit verdict FAIL routed to retro (agent-graded; see the audit report artifact) defect=CRITICAL-1: nested/array decoy defeats the ambiguity guard — candidateCount counts top-level balanced ob"
    ]
  },
  "carryover": [
    {
      "id": "address-audit-findings",
      "action": "resolve the audit findings that failed cycle 1427",
      "priority": "high"
    }
  ],
  "phases_run_verdict_not_adopted": [
    {
      "phase": "retro",
      "verdict": "FAIL"
    }
  ]
}
