{
  "cycle": 536,
  "run_id": "01KWT43NHAGCQG4HEHZNXNB9M6",
  "goal": "805f6cedd62d9c2b3592ec1750943ec1bf238e920f34884edead2205d01d7d55",
  "final_verdict": "PASS",
  "phases": [
    {
      "name": "cycle-recorded",
      "verdict": "PASS",
      "key_findings": "cycle completed; ledger walk deferred to future slice"
    }
  ]
}
