{
  "cycle": 672,
  "run_id": "01KX71XBWDP79KEKW5Y16YDZP6",
  "goal": "Work the weighted .evolve/inbox backlog top-down: for each cycle, implement the fleet-assigned inbox item (triage top_n is the sole task authority; scout scopes discovery to that item, never proposes alternative tasks). Priorities: echo-veto-wiring-completion, chronicle-s2-digest-writer, chronicle-s6-escalation-boundary, new-package-graduation-buildentry-gate (RETRY: cycle-664 shipped only a flag registration - the deterministic build-selfcheck guard + audit parity predicate are still missing; cycle-666 failed), all-families-exhausted-checkpoint-defer, tdd-topn-binding-gate. Preserve every phase-integrity guarantee and gate behavior.",
  "final_verdict": "PASS",
  "phases": [
    {
      "name": "cycle-recorded",
      "verdict": "PASS",
      "key_findings": "cycle completed; ledger walk deferred to future slice",
      "tokens": {
        "input": 0,
        "output": 0,
        "cache_read": 0,
        "cache_write": 0
      }
    }
  ]
}
